category,title,url,publish_date,word_count,author,tags_count,has_thumbnail
oto-xe-may,Xe máy lao cắm đầu vào ôtô phía trước,https://vnexpress.net/xe-may-lao-cam-dau-vao-oto-phia-truoc-4912372.html,2025-07-11T06:31:00+07:00,123,VnExpress,6,True
oto-xe-may,"VinFast có 13 đại lý, 32 showroom tại Ấn Độ",https://vnexpress.net/vinfast-co-13-dai-ly-32-showroom-tai-an-do-4913928.html,2025-07-14T14:30:00+07:00,518,VnExpress,7,True
oto-xe-may,Nữ tài xế phẩy tay để ôtô tự vào chỗ đỗ,https://vnexpress.net/nu-tai-xe-phay-tay-de-oto-tu-vao-cho-do-4921197.html,2025-08-01T10:12:38+07:00,369,VnExpress,7,True
oto-xe-may,Mercedes-AMG GT XX Concept - siêu sedan chạy điện,https://vnexpress.net/mercedes-amg-gt-xx-concept-sieu-sedan-chay-dien-4906525.html,2025-06-26T14:14:13+07:00,471,VnExpress,9,True
oto-xe-may,Cặp đôi kết hôn sau khi thoát chết khó tin trong tai nạn ôtô,https://vnexpress.net/cap-doi-ket-hon-sau-khi-thoat-chet-kho-tin-trong-tai-nan-oto-4922788.html,2025-08-06T06:31:00+07:00,256,VnExpress,6,True
oto-xe-may,"So sánh xe điện tầm giá 20 triệu: VinFast, Honda hay Yadea?",https://vnexpress.net/so-sanh-xe-dien-tam-gia-20-trieu-vinfast-honda-hay-yadea-4918444.html,2025-07-24T15:28:05+07:00,4,VnExpress,7,True
oto-xe-may,Camera giao thông phạt sai hơn 620.000 ôtô,https://vnexpress.net/camera-giao-thong-phat-sai-hon-620-000-oto-4905852.html,2025-06-26T04:00:00+07:00,610,VnExpress,8,True
oto-xe-may,Xe máy ngã sõng xoài khi va quệt với ôtô cùng chiều,https://vnexpress.net/xe-may-nga-song-xoai-khi-va-quet-voi-oto-cung-chieu-4915035.html,2025-07-17T04:00:00+07:00,228,VnExpress,6,True
oto-xe-may,'Những câu hỏi khó hiểu trong bộ đề sát hạch lái xe',https://vnexpress.net/nhung-cau-hoi-kho-hieu-trong-bo-de-sat-hach-lai-xe-4922300.html,2025-08-05T11:10:23+07:00,964,VnExpress,5,True
oto-xe-may,Xe tải vượt ẩu huých văng người đi xe máy,https://vnexpress.net/xe-tai-vuot-au-huych-vang-nguoi-di-xe-may-4923698.html,2025-08-07T13:42:59+07:00,159,VnExpress,6,True
oto-xe-may,"Yamaha NVX 155 2025 – xe tay ga thế hệ mới giá từ 56,5 triệu đồng",https://vnexpress.net/yamaha-nvx-155-2025-xe-tay-ga-the-he-moi-gia-tu-56-5-trieu-dong-4907047.html,2025-06-27T14:36:47+07:00,1502,VnExpress,6,True
oto-xe-may,"Xe tải đẩy thanh thép của xe máy vào ôtô con, ai phải đền?",https://vnexpress.net/xe-tai-day-thanh-thep-cua-xe-may-vao-oto-con-ai-phai-den-4911619.html,2025-07-10T07:44:00+07:00,538,VnExpress,5,True
oto-xe-may,Mazda6 2023 giá 730 triệu nên mua?,https://vnexpress.net/mazda6-2023-gia-730-trieu-nen-mua-4910897.html,2025-07-07T07:29:09+07:00,0,VnExpress,7,True
oto-xe-may,Xe máy lao ngang đường ép ôtô vào lề,https://vnexpress.net/xe-may-lao-ngang-duong-ep-oto-vao-le-4908962.html,2025-07-02T09:00:29+07:00,154,VnExpress,5,True
oto-xe-may,Chương trình 'Đổi xăng lấy điện' hút tài xế dịch vụ,https://vnexpress.net/chuong-trinh-doi-xang-lay-dien-hut-tai-xe-dich-vu-4920403.html,2025-07-30T09:30:00+07:00,880,VnExpress,8,True
oto-xe-may,Kia EV5 2026 sắp ra mắt,https://vnexpress.net/kia-ev5-2026-sap-ra-mat-4911641.html,2025-07-09T09:05:44+07:00,259,VnExpress,8,True
oto-xe-may,Chuyên gia Indonesia: 'Việt Nam là hình mẫu phát triển xe điện',https://vnexpress.net/chuyen-gia-indonesia-viet-nam-la-hinh-mau-phat-trien-xe-dien-4912407.html,2025-07-10T11:00:00+07:00,679,VnExpress,7,True
oto-xe-may,Xe máy điện Evo Grand hút khách tài xế công nghệ,https://vnexpress.net/xe-may-dien-evo-grand-hut-khach-tai-xe-cong-nghe-4921640.html,2025-08-01T15:30:00+07:00,792,VnExpress,7,True
oto-xe-may,Camera tự phát hiện xe hết hạn sử dụng,https://vnexpress.net/camera-tu-phat-hien-xe-het-han-su-dung-4909479.html,2025-07-04T05:57:00+07:00,533,VnExpress,9,True
oto-xe-may,Loạt hoạt động tại sự kiện BYD Technology Week,https://vnexpress.net/loat-hoat-dong-tai-su-kien-byd-technology-week-4922624.html,2025-08-06T19:00:00+07:00,445,VnExpress,7,True
oto-xe-may,Mua xe máy điện cũ cần lưu ý điều gì?,https://vnexpress.net/mua-xe-may-dien-cu-can-luu-y-dieu-gi-4914012.html,2025-07-16T07:00:00+07:00,0,VnExpress,5,True
oto-xe-may,Xiaomi YU7 bán hơn 200.000 xe trong 3 phút,https://vnexpress.net/xiaomi-yu7-ban-hon-200-000-xe-trong-3-phut-4906905.html,2025-06-27T10:13:31+07:00,563,VnExpress,10,True
oto-xe-may,Bus điện góp phần thay đổi thói quen của người dân,https://vnexpress.net/bus-dien-gop-phan-thay-doi-thoi-quen-cua-nguoi-dan-4920677.html,2025-07-05T09:00:00+07:00,828,VnExpress,6,True
oto-xe-may,Lexus khai tử một số dòng xe lâu đời của thương hiệu,https://vnexpress.net/lexus-khai-tu-mot-so-dong-xe-lau-doi-cua-thuong-hieu-4922083.html,2025-08-03T09:57:20+07:00,584,VnExpress,8,True
oto-xe-may,Hiệp hội xe máy Việt Nam: Cần 2-3 năm chuẩn bị để đổi sang xe điện,https://vnexpress.net/hiep-hoi-xe-may-viet-nam-can-2-3-nam-chuan-bi-de-doi-sang-xe-dien-4920134.html,2025-07-30T09:54:37+07:00,1041,VnExpress,13,True
oto-xe-may,"Giải pháp giao thông xanh từ xe tải, bus điện",https://vnexpress.net/giai-phap-giao-thong-xanh-tu-xe-tai-bus-dien-4908381.html,2025-07-01T20:00:00+07:00,0,VnExpress,0,True
oto-xe-may,"Toyota hoãn sản xuất xe điện, tăng sản lượng SUV chạy xăng",https://vnexpress.net/toyota-hoan-san-xuat-xe-dien-tang-san-luong-suv-chay-xang-4909420.html,2025-07-03T09:22:06+07:00,333,VnExpress,8,True
oto-xe-may,Honda Super Cub 50 Final Edition đầu tiên về Việt Nam,https://vnexpress.net/honda-super-cub-50-final-edition-dau-tien-ve-viet-nam-4917522.html,2025-07-23T03:56:00+07:00,982,VnExpress,4,True
oto-xe-may,Xe đã đăng ký nhưng chưa có phôi biển số ra đường có bị phạt?,https://vnexpress.net/xe-da-dang-ky-nhung-chua-co-phoi-bien-so-ra-duong-co-bi-phat-4907110.html,2025-06-28T06:18:00+07:00,17,VnExpress,6,True
oto-xe-may,MG ZS 2022 giá 430 triệu nên mua?,https://vnexpress.net/mg-zs-2022-gia-430-trieu-nen-mua-4911592.html,2025-07-08T14:13:17+07:00,0,VnExpress,6,True
oto-xe-may,Dấu hiệu nhận biết xe máy điện cần thay pin,https://vnexpress.net/dau-hieu-nhan-biet-xe-may-dien-can-thay-pin-4921193.html,2025-08-02T04:56:00+07:00,695,VnExpress,8,True
oto-xe-may,Những lỗi cơ bản dễ dẫn tới nhầm chân ga và phanh,https://vnexpress.net/nhung-loi-co-ban-de-dan-toi-nham-chan-ga-va-phanh-4912476.html,2025-07-10T15:38:57+07:00,882,VnExpress,10,True
oto-xe-may,Taxi lấn làn khiến người phụ nữ 'mài đường' trong mưa,https://vnexpress.net/taxi-lan-lan-khien-nguoi-phu-nu-mai-duong-trong-mua-4916541.html,2025-07-20T11:17:25+07:00,242,VnExpress,4,True
oto-xe-may,Xe bồn bị đá lở cuốn xuống vực,https://vnexpress.net/xe-bon-bi-da-lo-cuon-xuong-vuc-4921942.html,2025-08-04T09:04:04+07:00,179,VnExpress,4,True
oto-xe-may,Cây mọc giữa đường cao tốc vì cơ quan chức năng không chịu chặt,https://vnexpress.net/cay-moc-giua-duong-cao-toc-vi-co-quan-chuc-nang-khong-chiu-chat-4912979.html,2025-07-14T04:00:00+07:00,395,VnExpress,4,True
oto-xe-may,"Chuyên gia đưa giải pháp giao thông xanh từ xe tải, bus điện",https://vnexpress.net/chuyen-gia-dua-giai-phap-giao-thong-xanh-tu-xe-tai-bus-dien-4920678.html,2025-07-01T09:00:00+07:00,480,VnExpress,6,True
oto-xe-may,Ôtô Jeep giảm giá từ gần 7 tỷ về hơn 4 tỷ đồng,https://vnexpress.net/oto-jeep-giam-gia-tu-gan-7-ty-ve-hon-4-ty-dong-4913595.html,2025-07-13T11:13:30+07:00,399,VnExpress,7,True
oto-xe-may,Kia Việt Nam tung ưu đãi lớn nhất từ đầu năm,https://vnexpress.net/kia-viet-nam-tung-uu-dai-lon-nhat-tu-dau-nam-4912614.html,2025-07-10T16:00:00+07:00,468,VnExpress,5,True
oto-xe-may,Honda Super Cub 110 Hello Kitty nhập Nhật đầu tiên về Việt Nam,https://vnexpress.net/honda-super-cub-110-hello-kitty-nhap-nhat-dau-tien-ve-viet-nam-4907460.html,2025-06-29T06:26:00+07:00,1022,VnExpress,5,True
oto-xe-may,Nissan X-Trail e-Power 2025 - 'ôtô điện chạy xăng',https://vnexpress.net/nissan-x-trail-e-power-2025-oto-dien-chay-xang-4919828.html,2025-07-29T09:16:26+07:00,406,VnExpress,8,True
oto-xe-may,Honda Việt Nam tung ưu đãi cho xe gắn máy điện,https://vnexpress.net/honda-viet-nam-tung-uu-dai-cho-xe-gan-may-dien-4918235.html,2025-07-24T09:30:00+07:00,353,VnExpress,6,True
oto-xe-may,Môtô vẫn đi vững khi bị con nai tông trúng trên cao tốc,https://vnexpress.net/moto-van-di-vung-khi-bi-con-nai-tong-trung-tren-cao-toc-4911844.html,2025-07-12T04:35:00+07:00,292,VnExpress,7,True
oto-xe-may,Hành trình thực tế của xe điện Xiaomi không như công bố,https://vnexpress.net/hanh-trinh-thuc-te-cua-xe-dien-xiaomi-khong-nhu-cong-bo-4915746.html,2025-07-19T05:55:00+07:00,521,VnExpress,10,True
oto-xe-may,Nguy cơ ẩu đả khi cấm bán xăng cho xe ô nhiễm,https://vnexpress.net/nguy-co-au-da-khi-cam-ban-xang-cho-xe-o-nhiem-4906355.html,2025-06-27T07:25:00+07:00,927,VnExpress,9,True
oto-xe-may,"Peugeot 408 có thêm bản Legend Edition, giá tăng 20 triệu đồng",https://vnexpress.net/peugeot-408-co-them-ban-legend-edition-gia-tang-20-trieu-dong-4910420.html,2025-07-06T05:56:00+07:00,428,VnExpress,8,True
oto-xe-may,'Khi nào người dân muốn bỏ xe máy xăng?',https://vnexpress.net/khi-nao-nguoi-dan-muon-bo-xe-may-xang-4914375.html,2025-07-15T13:59:23+07:00,1008,VnExpress,4,True
oto-xe-may,Xe máy điện nào có thể chạy 60-70 km một lần sạc?,https://vnexpress.net/xe-may-dien-nao-co-the-chay-60-70-km-mot-lan-sac-4915864.html,2025-07-18T13:52:06+07:00,0,VnExpress,7,True
oto-xe-may,Siêu xe bị thu giữ vì chủ nợ quá nhiều phí đường bộ,https://vnexpress.net/sieu-xe-bi-thu-giu-vi-chu-no-qua-nhieu-phi-duong-bo-4910349.html,2025-07-06T03:56:00+07:00,318,VnExpress,4,True
oto-xe-may,Đoàn xe của Thủ hiến bang bị đổ dầu trộn nước,https://vnexpress.net/doan-xe-cua-thu-hien-bang-bi-do-dau-tron-nuoc-4907453.html,2025-06-29T04:08:00+07:00,176,VnExpress,4,True
oto-xe-may,"Lexus LX 700h ra mắt Đông Nam Á, giá cao nhất gần 240.000 USD",https://vnexpress.net/lexus-lx-700h-ra-mat-dong-nam-a-gia-cao-nhat-gan-240-000-usd-4920616.html,2025-07-31T06:56:00+07:00,405,VnExpress,13,True
oto-xe-may,"Infiniti QX60 2026 - SUV mới tinh chỉnh nhẹ, tăng giá bán",https://vnexpress.net/infiniti-qx60-2026-suv-moi-tinh-chinh-nhe-tang-gia-ban-4907738.html,2025-06-30T04:00:00+07:00,409,VnExpress,9,True
oto-xe-may,Những e ngại khi chuyển sang xe máy điện,https://vnexpress.net/nhung-e-ngai-khi-chuyen-sang-xe-may-dien-4921379.html,2025-08-01T12:11:30+07:00,1277,VnExpress,7,True
oto-xe-may,Xe ba gác làm rơi tảng đá lạnh xuống đường,https://vnexpress.net/xe-ba-gac-lam-roi-tang-da-lanh-xuong-duong-4923186.html,2025-08-06T08:52:34+07:00,203,VnExpress,6,True
oto-xe-may,Infiniti QX80 Sport 2026 ra mắt,https://vnexpress.net/infiniti-qx80-sport-2026-ra-mat-4923918.html,2025-08-08T10:08:02+07:00,375,VnExpress,9,True
oto-xe-may,Mạng lưới trạm sạc xe điện Mỹ trên đà tăng vọt,https://vnexpress.net/mang-luoi-tram-sac-xe-dien-my-tren-da-tang-vot-4920767.html,2025-08-02T05:57:00+07:00,1034,VnExpress,7,True
oto-xe-may,Thử nghiệm và xếp hạng công nghệ an toàn trên 36 ôtô,https://vnexpress.net/thu-nghiem-va-xep-hang-cong-nghe-an-toan-tren-36-oto-4918196.html,2025-07-25T04:55:00+07:00,550,VnExpress,7,True
oto-xe-may,GF bán VF 8 đã qua sử dụng với kiểm định từ VinFast,https://vnexpress.net/gf-ban-vf-8-da-qua-su-dung-voi-kiem-dinh-tu-vinfast-4910303.html,2025-07-05T11:30:00+07:00,422,VnExpress,8,True
oto-xe-may,Suzuki GSX-R1000R bản kỷ niệm 40 năm ra mắt,https://vnexpress.net/suzuki-gsx-r1000r-ban-ky-niem-40-nam-ra-mat-4921361.html,2025-08-01T14:06:16+07:00,427,VnExpress,9,True
oto-xe-may,Tesla hầu tòa vì tai nạn chết người liên quan hệ thống tự lái,https://vnexpress.net/tesla-hau-toa-vi-tai-nan-chet-nguoi-lien-quan-he-thong-tu-lai-4915332.html,2025-07-17T14:10:33+07:00,659,VnExpress,7,True
oto-xe-may,VinFast khai trương showroom lớn nhất tại Ấn Độ,https://vnexpress.net/vinfast-khai-truong-showroom-lon-nhat-tai-an-do-4922105.html,2025-08-03T10:00:00+07:00,404,VnExpress,8,True
oto-xe-may,VinFast nâng dung lượng pin Minio Green,https://vnexpress.net/vinfast-nang-dung-luong-pin-minio-green-4909309.html,2025-07-02T17:30:00+07:00,367,VnExpress,7,True
oto-xe-may,Hyundai nghiên cứu xe điện của Xiaomi,https://vnexpress.net/hyundai-nghien-cuu-xe-dien-cua-xiaomi-4917762.html,2025-07-29T04:57:00+07:00,481,VnExpress,8,True
oto-xe-may,Ám ảnh lái xe trên cao tốc trong đêm,https://vnexpress.net/am-anh-lai-xe-tren-cao-toc-trong-dem-4915852.html,2025-07-19T06:56:00+07:00,1075,VnExpress,6,True
oto-xe-may,Thị trường xe máy điện trước cú hích lớn,https://vnexpress.net/thi-truong-xe-may-dien-truoc-cu-hich-lon-4914771.html,2025-07-17T04:57:00+07:00,1648,VnExpress,7,True
oto-xe-may,Ôtô mini vượt như xe đua trên đèo quanh co,https://vnexpress.net/oto-mini-vuot-nhu-xe-dua-tren-deo-quanh-co-4908080.html,2025-06-30T14:19:45+07:00,222,VnExpress,5,True
oto-xe-may,Ôtô con chặn đầu xe khác sau khi vượt ẩu,https://vnexpress.net/oto-con-chan-dau-xe-khac-sau-khi-vuot-au-4916959.html,2025-07-22T06:56:00+07:00,145,VnExpress,6,True
oto-xe-may,BYD Atto 2 - làn gió mới ở phân khúc khắc nghiệt,https://vnexpress.net/byd-atto-2-lan-gio-moi-o-phan-khuc-khac-nghiet-4922365.html,2025-08-04T10:29:16+07:00,2,VnExpress,9,True
oto-xe-may,Mazda3 2019 giá 470 triệu nên mua?,https://vnexpress.net/mazda3-2019-gia-470-trieu-nen-mua-4911348.html,2025-07-08T07:02:04+07:00,0,VnExpress,5,True
oto-xe-may,Toyota Urban Cruiser EV chào thị trường Đông Nam Á,https://vnexpress.net/toyota-urban-cruiser-ev-chao-thi-truong-dong-nam-a-4918516.html,2025-07-25T08:30:02+07:00,320,VnExpress,8,True
oto-xe-may,Một ngày làm tay đua xe Ferrari,https://vnexpress.net/mot-ngay-lam-tay-dua-xe-ferrari-4918592.html,2025-07-28T05:56:00+07:00,1203,VnExpress,4,True
oto-xe-may,"Miễn thủ tục kiểm tra ma túy, giờ nghỉ cho xe tải tự hành",https://vnexpress.net/mien-thu-tuc-kiem-tra-ma-tuy-gio-nghi-cho-xe-tai-tu-hanh-4920004.html,2025-07-30T05:00:00+07:00,626,VnExpress,7,True
oto-xe-may,Xe con gây tai nạn với hai xe tải vì vượt ẩu,https://vnexpress.net/xe-con-gay-tai-nan-voi-hai-xe-tai-vi-vuot-au-4919290.html,2025-07-27T00:00:00+07:00,237,VnExpress,6,True
oto-xe-may,Hai xe taxi không người lái tự đâm nhau,https://vnexpress.net/hai-xe-taxi-khong-nguoi-lai-tu-dam-nhau-4921614.html,2025-08-02T06:47:00+07:00,353,VnExpress,6,True
oto-xe-may,Cách những thủ phủ xe máy trên thế giới hạn chế xe xăng,https://vnexpress.net/cach-nhung-thu-phu-xe-may-tren-the-gioi-han-che-xe-xang-4914063.html,2025-07-16T03:46:00+07:00,1276,VnExpress,6,True
oto-xe-may,Hơn 400 triệu nên mua MG5 2023?,https://vnexpress.net/hon-400-trieu-nen-mua-mg5-2023-4922699.html,2025-08-05T07:12:45+07:00,0,VnExpress,8,True
oto-xe-may,Môtô điện thiết kế như đường ống nước,https://vnexpress.net/moto-dien-thiet-ke-nhu-duong-ong-nuoc-4914547.html,2025-07-16T10:07:36+07:00,614,VnExpress,9,True
oto-xe-may,Omoda & Jaecoo triển khai 10.000 lượt lái thử xe,https://vnexpress.net/omoda-jaecoo-trien-khai-10-000-luot-lai-thu-xe-4915146.html,2025-07-16T19:00:00+07:00,367,VnExpress,5,True
oto-xe-may,Hyundai Elexio lộ thiết kế nội thất,https://vnexpress.net/hyundai-elexio-lo-thiet-ke-noi-that-4911656.html,2025-07-10T07:13:00+07:00,287,VnExpress,8,True
oto-xe-may,"Nhà máy ôtô dùng 5G và AI, 60 giây một xe xuất xưởng",https://vnexpress.net/nha-may-oto-dung-5g-va-ai-60-giay-mot-xe-xuat-xuong-4920010.html,2025-07-29T10:20:10+07:00,650,VnExpress,9,True
oto-xe-may,Loạt ôtô mới ra mắt tháng 7 tại Việt Nam,https://vnexpress.net/loat-oto-moi-ra-mat-thang-7-tai-viet-nam-4908951.html,2025-07-02T08:36:22+07:00,1035,VnExpress,10,True
oto-xe-may,Tranh cãi độ trung thực của thử nghiệm ôtô điện đấu đầu xe tải,https://vnexpress.net/tranh-cai-do-trung-thuc-cua-thu-nghiem-oto-dien-dau-dau-xe-tai-4922417.html,2025-08-05T03:56:00+07:00,892,VnExpress,7,True
oto-xe-may,Omoda C5 nhận ưu đãi trả trước từ 0 đồng,https://vnexpress.net/omoda-c5-nhan-uu-dai-tra-truoc-tu-0-dong-4923709.html,2025-08-07T20:00:00+07:00,348,VnExpress,5,True
oto-xe-may,Dùng tay bóc mặt đường mới xây để tố chất lượng kém,https://vnexpress.net/dung-tay-boc-mat-duong-moi-xay-de-to-chat-luong-kem-4911862.html,2025-07-12T07:07:00+07:00,198,VnExpress,6,True
oto-xe-may,Bestune Pony EV 2026 - xe điện mini giá chưa đến 5.000 USD,https://vnexpress.net/bestune-pony-ev-2026-xe-dien-mini-gia-chua-den-5-000-usd-4920317.html,2025-07-30T12:22:42+07:00,308,VnExpress,7,True
oto-xe-may,Trạm sạc Tesla lớn nhất thế giới không kết nối lưới điện,https://vnexpress.net/tram-sac-tesla-lon-nhat-the-gioi-khong-ket-noi-luoi-dien-4911597.html,2025-07-09T05:54:00+07:00,585,VnExpress,9,True
oto-xe-may,"Hyundai Stargazer bản nâng cấp ra mắt, giá từ 16.600 USD",https://vnexpress.net/hyundai-stargazer-ban-nang-cap-ra-mat-gia-tu-16-600-usd-4918735.html,2025-07-26T08:28:30+07:00,690,VnExpress,10,True
oto-xe-may,Xe máy lao vào xe khác như đạn bắn ở vòng xuyến,https://vnexpress.net/xe-may-lao-vao-xe-khac-nhu-dan-ban-o-vong-xuyen-4909403.html,2025-07-03T08:45:00+07:00,102,VnExpress,6,True
oto-xe-may,Siêu xe Ferrari bốc cháy trên cao tốc,https://vnexpress.net/sieu-xe-ferrari-boc-chay-tren-cao-toc-4909458.html,2025-07-03T13:50:00+07:00,170,VnExpress,7,True
oto-xe-may,Thủ tục rút hồ sơ ôtô cũ từ 1/7?,https://vnexpress.net/thu-tuc-rut-ho-so-oto-cu-tu-1-7-4907880.html,2025-07-01T11:05:07+07:00,0,VnExpress,5,True
oto-xe-may,Toyota Vios 2022 giá 460 triệu nên mua?,https://vnexpress.net/toyota-vios-2022-gia-460-trieu-nen-mua-4908455.html,2025-07-01T07:22:49+07:00,0,VnExpress,7,True
oto-xe-may,Có thể bị phạt tù nếu chạy chậm trên cao tốc,https://vnexpress.net/co-the-bi-phat-tu-neu-chay-cham-tren-cao-toc-4925062.html,2025-08-10T14:20:10+07:00,443,VnExpress,13,True
oto-xe-may,Ôtô bốc cháy sau khi chạy qua vũng nước,https://vnexpress.net/oto-boc-chay-sau-khi-chay-qua-vung-nuoc-4907953.html,2025-06-30T11:49:38+07:00,108,VnExpress,7,True
oto-xe-may,Loạt ôtô giảm giá trăm triệu tới hàng tỷ đồng tháng 7,https://vnexpress.net/loat-oto-giam-gia-tram-trieu-toi-hang-ty-dong-thang-7-4914049.html,2025-07-15T04:51:00+07:00,511,VnExpress,11,True
oto-xe-may,10 mẫu ôtô bán chạy nhất thế giới năm 2024: Toyota áp đảo,https://vnexpress.net/10-mau-oto-ban-chay-nhat-the-gioi-nam-2024-toyota-ap-dao-4908558.html,2025-07-01T11:52:39+07:00,574,VnExpress,9,True
oto-xe-may,Khởi động giải đấu MG Pickleball Championship 2025,https://vnexpress.net/khoi-dong-giai-dau-mg-pickleball-championship-2025-4917568.html,2025-07-22T17:00:00+07:00,462,VnExpress,5,True
oto-xe-may,"Ngày mai, ở Hà Nội diễn ra chương trình đổi ôtô điện",https://vnexpress.net/ngay-mai-o-ha-noi-dien-ra-chuong-trinh-doi-oto-dien-4912562.html,2025-07-10T17:00:00+07:00,696,VnExpress,8,True
oto-xe-may,Dàn xe đặc chủng của Bộ Công an tập luyện A80,https://vnexpress.net/dan-xe-dac-chung-cua-bo-cong-an-tap-luyen-a80-4923621.html,2025-08-07T00:00:00+07:00,2,VnExpress,8,True
oto-xe-may,Hai người đi xe máy trượt ngã vào gầm xe khách,https://vnexpress.net/hai-nguoi-di-xe-may-truot-nga-vao-gam-xe-khach-4907119.html,2025-06-28T05:28:00+07:00,179,VnExpress,7,True
oto-xe-may,VinFast khai trương showroom đầu tiên tại Ấn Độ,https://vnexpress.net/vinfast-khai-truong-showroom-dau-tien-tai-an-do-4919503.html,2025-07-27T16:30:23+07:00,409,VnExpress,6,True
oto-xe-may,"VinFast Limo Green: tăng tốc ổn khi đủ tải, hàng ghế ba rộng",https://vnexpress.net/vinfast-limo-green-tang-toc-on-khi-du-tai-hang-ghe-ba-rong-4922954.html,2025-08-05T16:36:13+07:00,674,VnExpress,8,True
oto-xe-may,Người đi xe máy đấm tài xế ôtô sau va chạm nhẹ,https://vnexpress.net/nguoi-di-xe-may-dam-tai-xe-oto-sau-va-cham-nhe-4918194.html,2025-07-24T09:00:54+07:00,210,VnExpress,6,True
oto-xe-may,VinFast bàn giao lô xe điện 7 chỗ Limo Green đầu tiên,https://vnexpress.net/vinfast-ban-giao-lo-xe-dien-7-cho-limo-green-dau-tien-4923033.html,2025-08-05T17:00:00+07:00,486,VnExpress,6,True
oto-xe-may,Toyota Hilux - bán tải cỡ trung bán chạy nhất thế giới,https://vnexpress.net/toyota-hilux-ban-tai-co-trung-ban-chay-nhat-the-gioi-4914972.html,2025-07-16T20:00:00+07:00,892,VnExpress,6,True
oto-xe-may,Suzuki eVitara - crossover điện sắp bán ở Đông Nam Á,https://vnexpress.net/suzuki-evitara-crossover-dien-sap-ban-o-dong-nam-a-4920272.html,2025-07-30T07:00:00+07:00,262,VnExpress,9,True
oto-xe-may,"Hà Nội nghiên cứu tăng lệ phí trước bạ, phí biển số ôtô, xe máy chạy xăng, dầu",https://vnexpress.net/ha-noi-nghien-cuu-tang-le-phi-truoc-ba-phi-bien-so-oto-xe-may-chay-xang-dau-4913579.html,2025-07-13T10:49:21+07:00,723,VnExpress,7,True
oto-xe-may,Hãng tàu biển từ chối chở xe điện và hybrid vì sợ cháy nổ,https://vnexpress.net/hang-tau-bien-tu-choi-cho-xe-dien-va-hybrid-vi-so-chay-no-4922700.html,2025-08-05T10:25:43+07:00,591,VnExpress,10,True
oto-xe-may,Ford sắp bán xe điện Mustang Mach-E tại Việt Nam,https://vnexpress.net/ford-sap-ban-xe-dien-mustang-mach-e-tai-viet-nam-4915827.html,2025-07-19T04:00:00+07:00,520,VnExpress,7,True
oto-xe-may,Hai ôtô rước họa vì xe máy chở thanh kim loại,https://vnexpress.net/hai-oto-ruoc-hoa-vi-xe-may-cho-thanh-kim-loai-4911355.html,2025-07-08T08:59:14+07:00,156,VnExpress,7,True
oto-xe-may,Điểm mù của ôtô ngày càng lớn,https://vnexpress.net/diem-mu-cua-oto-ngay-cang-lon-4908703.html,2025-07-02T03:56:00+07:00,854,VnExpress,4,True
y-kien,Treo biển cà phê pha máy 15k nhưng rót từ chai nhựa,https://vnexpress.net/gia-ca-phe-hom-nay-ca-phe-pha-may-trong-binh-giu-nhiet-4896595.html,2025-06-09T19:00:00+07:00,276,VnExpress,7,True
y-kien,Lỗ hổng thuế bất động sản thứ hai từ 2.300 lô đất của Hậu 'Pháo',https://vnexpress.net/lo-hong-thue-bat-dong-san-thu-hai-tu-2-300-lo-dat-cua-hau-phao-4905947.html,2025-06-25T10:29:48+07:00,758,VnExpress,12,True
y-kien,Dở khóc dở cười vì mua quần áo 'như mua hàng lậu',https://vnexpress.net/do-khoc-do-cuoi-vi-mua-quan-ao-nhu-mua-hang-lau-4896073.html,2025-06-08T16:08:06+07:00,641,VnExpress,6,True
y-kien,"Tôi bị hoa mắt, chóng mặt sau khi uống cà phê để tỉnh táo",https://vnexpress.net/toi-bi-hoa-mat-chong-mat-sau-khi-uong-ca-phe-de-tinh-tao-4922114.html,2025-08-03T10:55:59+07:00,361,VnExpress,8,True
y-kien,"Bố mẹ còng lưng trả 2,5 tỷ nợ mua nhà, con sống 'vô tư' lương 10 triệu đồng",https://vnexpress.net/bo-me-cong-lung-tra-2-5-ty-no-mua-nha-con-song-vo-tu-luong-10-trieu-dong-4910251.html,2025-07-04T19:00:00+07:00,404,VnExpress,7,True
y-kien,Dẹp dần tắc đường khi thay xe xăng bằng xe điện ở Hà Nội,https://vnexpress.net/dep-dan-tac-duong-khi-thay-xe-xang-bang-xe-dien-o-ha-noi-4923642.html,2025-08-06T20:22:33+07:00,676,VnExpress,9,True
y-kien,Mất 300 triệu và 4 tháng tạm giam vì nóng giận shipper,https://vnexpress.net/tai-xe-lexus-danh-shipper-o-ha-noi-duoc-tra-tu-do-4895003.html,2025-06-05T16:42:11+07:00,634,VnExpress,6,True
y-kien,Đăng ảnh chồng con lên Facebook để khoe hạnh phúc,https://vnexpress.net/khoe-khoang-tren-mang-xa-hoi-la-gi-toi-khong-dang-anh-chong-con-len-facebook-de-khoe-hanh-phuc-4894953.html,2025-06-05T15:32:50+07:00,830,VnExpress,12,True
y-kien,"'Mẹ học hết lớp 8 vẫn có tiền tỷ, sao ép con học giỏi'",https://vnexpress.net/10-cach-hoc-gioi-tat-ca-cac-mon-chi-chu-vua-trai-cay-ep-con-hoc-gioi-day-con-nha-tien-ty-4912613.html,2025-07-10T19:24:51+07:00,524,VnExpress,7,True
y-kien,Thế khó xử của chủ nhà trọ 'thà để trống chứ không cho người đi xe điện thuê',https://vnexpress.net/xe-dien-honda-xe-dien-chay-tram-sac-xe-dien-tram-sac-xe-may-dien-o-ha-noi-ha-noi-cam-xe-may-vanh-dai-1-4920614.html,2025-07-30T10:43:13+07:00,1107,VnExpress,8,True
y-kien,Tư duy ngược giúp người bán phân bón thành đại gia cà phê,https://vnexpress.net/lam-giau-tu-nong-nghiep-tu-duy-lam-an-nguoc-dong-dau-tu-dat-nong-nghiep-tu-duy-nguoc-giup-nguoi-ban-phan-bon-thanh-dai-gia-ca-phe-4919819.html,2025-07-28T15:02:19+07:00,677,VnExpress,10,True
y-kien,Tôi chịu thua đề thi vào lớp 10 trường chuyên dù đạt 10 điểm Toán tốt nghiệp THCS,https://vnexpress.net/diem-san-dai-hoc-diem-chuan-dai-hoc-tra-cuu-diem-thi-tot-nghiep-thpt-10-diem-toan-tot-nghiep-thcs-nhung-toi-chiu-thua-bai-thi-vao-lop-10-truong-chuyen-4922295.html,2025-08-04T09:09:44+07:00,689,VnExpress,10,True
y-kien,"Thầy dạy lái xe chỉ biết hô 'vào số một, nhả côn, lên số' rồi chửi tục",https://vnexpress.net/hoc-phi-hoc-lai-xe-o-to-o-tphcm-hoc-phi-b2-giao-vien-day-lai-xe-truong-nghe-4912487.html,2025-07-11T07:17:05+07:00,713,VnExpress,6,True
y-kien,"Tai nghe chồng ồn '2,6 triệu đồng giảm còn 799.000 đồng' tắt tiếng sau 30 phút",https://vnexpress.net/hang-fake-loai-1-tai-nghe-chong-on-2-6-trieu-dong-giam-con-799-000-dong-tat-tieng-sau-30-phut-4895851.html,2025-06-08T00:00:00+07:00,865,VnExpress,10,True
